[
  {
    "occurredAt": "2026-06-15T11:23:17.412+03:00",
    "actor": "system:api",
    "action": "AlertReceived",
    "alertId": "8e2f7c8a-1b3d-4e5f-9a0b-2c4d6e8f0a12",
    "serverName": "APPSRV-12.contoso.local",
    "correlationId": "00-f1a2b3c4d5e6f708a9b0c1d2e3f40516-1234567890abcdef-01",
    "sourceIp": "198.51.100.55",
    "details": {
      "externalId": "SW-ALERT-12345",
      "turuncuhatEvtId": "EVT-54321",
      "alertType": "Disk",
      "severity": "High"
    }
  },
  {
    "occurredAt": "2026-06-15T11:23:17.900+03:00",
    "actor": "system:api",
    "action": "TuruncuhatEvtFetched",
    "alertId": "8e2f7c8a-1b3d-4e5f-9a0b-2c4d6e8f0a12",
    "serverName": "APPSRV-12.contoso.local",
    "correlationId": "00-f1a2b3c4d5e6f708a9b0c1d2e3f40516-1234567890abcdef-01",
    "details": {
      "turuncuhatEvtId": "EVT-54321",
      "integrationMode": "api-pull"
    }
  },
  {
    "occurredAt": "2026-06-15T11:23:18.005+03:00",
    "actor": "system:api",
    "action": "DiagnosticEnqueued",
    "alertId": "8e2f7c8a-1b3d-4e5f-9a0b-2c4d6e8f0a12",
    "serverName": "APPSRV-12.contoso.local",
    "correlationId": "00-f1a2b3c4d5e6f708a9b0c1d2e3f40516-1234567890abcdef-01",
    "details": {
      "module": "DiskDiagnostic",
      "hangfireJobId": "451213"
    }
  },
  {
    "occurredAt": "2026-06-15T11:23:20.118+03:00",
    "actor": "system:worker",
    "action": "DiagnosticStarted",
    "alertId": "8e2f7c8a-1b3d-4e5f-9a0b-2c4d6e8f0a12",
    "serverName": "APPSRV-12.contoso.local",
    "correlationId": "00-f1a2b3c4d5e6f708a9b0c1d2e3f40516-1234567890abcdef-01",
    "details": { "module": "DiskDiagnostic" }
  },
  {
    "occurredAt": "2026-06-15T11:23:24.639+03:00",
    "actor": "system:worker",
    "action": "DiagnosticCompleted",
    "alertId": "8e2f7c8a-1b3d-4e5f-9a0b-2c4d6e8f0a12",
    "serverName": "APPSRV-12.contoso.local",
    "correlationId": "00-f1a2b3c4d5e6f708a9b0c1d2e3f40516-1234567890abcdef-01",
    "details": {
      "module": "DiskDiagnostic",
      "durationMs": 4521,
      "inferredSeverity": "High"
    }
  },
  {
    "occurredAt": "2026-06-15T11:25:02.221+03:00",
    "actor": "CONTOSO\\jane.doe",
    "action": "AlertViewed",
    "alertId": "8e2f7c8a-1b3d-4e5f-9a0b-2c4d6e8f0a12",
    "serverName": "APPSRV-12.contoso.local",
    "correlationId": "00-aa11bb22cc33dd44ee55ff6677889900-fedcba9876543210-01",
    "sourceIp": "198.51.100.18",
    "details": { "viewedSection": "DiagnosticDetail" }
  },
  {
    "occurredAt": "2026-06-15T11:27:48.770+03:00",
    "actor": "CONTOSO\\jane.doe",
    "action": "AlertAcknowledged",
    "alertId": "8e2f7c8a-1b3d-4e5f-9a0b-2c4d6e8f0a12",
    "serverName": "APPSRV-12.contoso.local",
    "details": { "notes": "Investigating log retention." }
  },
  {
    "occurredAt": "2026-06-15T11:40:10.315+03:00",
    "actor": "system:api",
    "action": "TuruncuhatActionMarked",
    "alertId": "8e2f7c8a-1b3d-4e5f-9a0b-2c4d6e8f0a12",
    "serverName": "APPSRV-12.contoso.local",
    "details": {
      "turuncuhatEvtId": "EVT-54321",
      "actionTaken": true
    }
  },
  {
    "occurredAt": "2026-06-15T11:42:31.902+03:00",
    "actor": "system:api",
    "action": "TuruncuhatEvtClosed",
    "alertId": "8e2f7c8a-1b3d-4e5f-9a0b-2c4d6e8f0a12",
    "serverName": "APPSRV-12.contoso.local",
    "details": {
      "turuncuhatEvtId": "EVT-54321",
      "status": "Çözüldü"
    }
  },
  {
    "occurredAt": "2026-06-15T13:02:11.000+03:00",
    "actor": "CONTOSO\\audit.reader",
    "action": "AuditQueried",
    "details": {
      "filters": { "timeRange": "last24h", "actionType": "DiagnosticCompleted" },
      "resultCount": 42,
      "purpose": "Monthly SLA evidence preparation"
    }
  }
]
